name,review,rating
고유,너어어어어무 맘에들어요 사장님도 친절하시구 애기랑 갔는데 불편한거 하나 없이 편하게 다녀왓어요. 취사 안되니까 오히려 깨끗하고 너무 좋았습니다.,
싸목싸목,"할머니, 엄마, 외숙모와 떠난 1박 2일 여행을 행복하게 해 주었던 숙소였습니다. 어른들 만족시키기 쉽지 않은데 할머니 옛생각 불러 일으키는 넓은 한옥집에, 위생&청결 중시하는 엄마도 대만족, 젊은 감각 좋아하는 외숙모 취향까지 저격하는 완벽한 곳이었네요. 할머니는 호텔보다 이런 한옥집이 더 편하다고 하셨어요. 인테리어며 청결도며 어느 하나 신경 안쓰신 점이 없으신것 같더라구요. 대문이 길가라 조금 시끄럽지 않을까 했는데 너무 조용&안전하고 프라이빗한 뒷마당도 아늑하고 평화로웠어요! 진짜 만족스러운 하룻밤이었습니다!!!",
싸목싸목,엄마 모시고 동생네와 총 8명 가족아주~ 편히 잘 놀다왔싸목^^너무 감싸목싸목 합니다 한옥마을 중심&남부시장 모두 인접해서더욱 좋더라구요아침 오목대 산책도 빼놓지 마세용,
싸목싸목,오늘의 우리집🏠🧡💛말하면 입아플만큼 행복했던시간 :)키워드 10개쯤 선택할수있으면 좋겠슴미다🥴,
싸목싸목,방도 많고 방마다 화장실이 있어서 너무 좋았어요!!냉난방 온수 다 잘 되고진짜 진짜 너무 이쁜 숙소였어요!!😊😊😊,
싸목싸목,"부모님 모시고 갔는데 너무 좋아하셨어요내부 인테리어 깔끔하고 이쁘고,각 방마다 화장실 있는게 너무 좋았어요체크인을 늦게해서 늦은시간에 연락드렸는데 친절하게 응답해주셨어요",
싸목싸목,"사장님 너무 친절하세요~한옥마을에 있고 숙소 근처 전주천 따라 산책하기 좋습니다. 전주천에 춘향이가 타는 긴 그네 있어서 타봤네요. 향교도 가까이 있어서 들려보세요~10분 거리에 ""스물다섯 스물하나"" 찍은 한벽터널 있어요~ 백이진이랑 나희도랑 싸웠던 ㅎㅎ백이진 팬분들은 가서 사진 찍으세요 ㅎㅎ방마다 화장실이 있어서 여러 가족이 머물기 좋을 것 같습니다. 거실에서 다같이 맥주한잔 하기도 좋고~한옥이라 웃풍이 있을까봐 걱정했는데, 더울 정도로 난방 잘 됩니다.부엌에 냉온정수기, 전자레인지 다 있어서 편하고, 이불, 수건 모두 청결하게 준비되어 있었습니다~전주여행 잘 하고, 잘 머물다 갑니다~~^^",
싸목싸목,완전 좋아요가족 친구 안성맞춤일듯또 전주가믄 여기 바로 픽할거예요,
싸목싸목,깨끗하고 들어갔을때 향기도 좋았어요한옥이라 그런지 약간 개미가 있었지만느끼기엔 깨끗했습니다부모님도 좋아하셨고 가족들과 즐거운 시간보낼수 있었어요,
싸목싸목,결혼전에 한번갔다가 너무너무 좋은기억 밖에없어서결혼 후 한번 더갔는데 역시 싸목싸목은 최고인거같아요시설도 너무 잘되있고 마루에 가만히있어도 힐링되는 너무 멋진곳이예요!!!!기회가 된다면 싸목싸목에서 한달 살기하고 싶을정도로 너무 좋은 곳이예요~👍🏻👍🏻,
싸목싸목,"가정의달 맞아 시댁부모님과 가족들 모시고 2박 정말 잘 쉬다왔습니다.총 7명이 예약하고 갔는데 각자 방과 화장실이 있어서 모두 너무 만족했어요~ 인테리어도 잘 되어있고 침구,화장실 청소도 너무 깔끔하게 준비해 주시어 만족하였습니다.어르신들도 다시 오시고 싶을 정도로 맘에 드신다 하여 너무 다행이였어요🤍위치는 한옥마을 중심가가 아니라 오히려 조용하고 아늑했고 그렇다고 해서 넘 외진건 아니라 밤에도 산책다니고 했을 거리였어요.진짜 다 만족이였는데 한옥마을 특성상 주차는 어쩔수 없이 좀 불편 하였지만ㅠ 그래도 주인장님께서 알기 쉽게 안내해주셔서 괜찮았어요~대가족 독채 묵으신다고 하면 정말 강추합니다!!",
햇살가득,스냅사진 재밌게 잘 찍었어요~숙소 위치가 좋고 분위기도 좋아요짐이 많아서 걱정했는데 짐도 맡겨주셔서 너무 감사해요사장님께서 너무 친절하셔서 또 가고 싶어요친구들한테 숙소와 스냅사진 풀코스로 전주 가면 꼭 해야한다고 추천해줬어요!정말 잘 쉬고 좋은 추억 만들었어요~,
햇살가득,이번 여행 중 최고의 숙소였어요♥︎ 사장님도 친절하시고 숙소도 완전 깨끗했어요. 특히 화장실이 깨끗해서 아주 마음에 들었습니다.그리고 무료주차를 할 수 있다는게 엄청난 장점이네요!!한옥체험 처음 해봤는데 숙소 자체가 너무 아름답고 분위기가 좋아서 마음같아서는 며칠 더 지내고 싶었습니다ㅠㅠ 마루에 앉아있으면 바람도 솔솔 불어서 조용히 힐링하다가 왔어요. 심지어 비가 왔는데 빗소리조차 아름다웠습니다♥︎한옥체험이 너무 좋아서 나중에 엄마랑 꼭 다시 방문하고싶을 정도에요!! 전주 가시는 분들 햇살가득 강추입니다~~~,
햇살가득,너무나 좋았던 햇살가득^^ 신랑과 결혼기념일이 여서 전주에 갔는데 햇살가득 에서 한옥을 느낄수있어 너무 좋았습니다^^ 사장님도 너무 친절 하셔서 정말 좋았습니다👍👍 특히 햇살가득 에는 한복대여도 함께 해서 더더좋았습니다^^,
햇살가득,인스타에 올리자마자 반응폭발이었던 햇살가득🌟눈길 닿는 곳 마다 다 이뻐서 아무렇게나 사진 찍어도 감성이 가득묻어나요오- 너무 좋았어요오 ㅠㅠ,
햇살가득,"친절한 사장님 덕분에 힐링 제대로 했던 햇살가득입니다🤩비수기에 친구와 첫 전주여행이었는데 방도 큰 사이즈로 옮겨주셨고, 궁금한 점 문의드릴때마다 친절하게 응대해주셔서 기억에 남아요!고즈넉한 한옥의 운치도 즐기고, 한복도 추가요금 내면 종일 대여할 수 있어서 좋았습니다😇 (사장님께서 옷 입을때 적극 도와주셔서 넘 감사했어요!)",
햇살가득,"아이 유치원 졸업여행으로 오랬만에 전주 한옥마을에 왔어요. 사진으로 봤을때도 다른 한옥 숙소와는 다르게 단정하고 세련된 분위기가 마음에 들어서 예약했는데 실제로 와서 보니 그 느낌 그대로 너무 깨끗하고 따뜻해서 좋았어요. 내부, 외부 모두 이쁜 인테리어 덕분에 아이들 이쁜 사진도 많이 남길 수 있어서 그게 젤 좋았어요. 물놀이 하면서 빔프로젝트도 볼 수 있고 수영장과 다르게 물온도도 따듯하게 조절가능해서 아이들 놀기 더 좋은것 같아요.침구에 예민한 편인데 넘 깔끔해서 식구들 모두 편히 잘 잤어요.후기 남기지 않는데 오픈한지 얼마 안되서 잘 알려지지 않은것 같아 후기 남겨요.한옥마을 한바퀴 돌아봤지만 식구들 모두 우리 숙소가 제일 이뿌다 했어요.다음에 또 전주오게 되면 재방문 할께요.별5개 강추예요!",
햇살가득,전주한옥마을 감성숙소 새로오픈한 곳이라고 해서 1박 하고 다녀왔어요 공간도 넓고 예쁜데 화장실에 있는 어메니티도 이솝 제품이라 놀랐어용 ✨ 침대도 크고 푹신해서 자는데 너무 편해서 1박 더 하고 오고 싶었네요 다음에 또 오고 싶어용 U0001f979,
햇살가득,"정말 너무너무 좋았어요! 햇살도 잘 들고, 차 소리 없는 조용한 환경에 새소리 지저귀는 것까지 완벽! 방도 깨끗하고, 완전 따뜻했어요ㅎㅎ 한복대여도 만원이면 할 수 있고, 머리도 어울리게 잘 해주셨어요! 사장님이 엄청 쿨하고 친절하셔요ㅎㅎ",
햇살가득,숙소 곳곳에 있는 초록초록한 식물이랑 원목 가구 소품들이 잘 어우러져서 예쁘고 사진도 아무렇게나 찍어도 감성가득 담겨져나오네요 ㅎㅎㅎ 인스타 올렸는데 지인들이 어디냐고 물어보고 반응장난아니었네요 ㅎㅎ,
햇살가득,예쁘고 깨끗하고 잘 쉬다왔어요~ 생각보다 아담했지만 불편함없이 이용했어요~ 재방문의사 100%,
달달잠,"2층 독채로 쓰면 친구들이랑 가기 좋다. 화장실이 많아서 싸울 일이 없으니까. 위치도 한옥 마을이랑 제법 가깝다. 아주머니도 친절하시다.다만, 야외 식탁을 제외하면 그럴 싸한 식탁이 없어 식사를 하는데 불편하다. 무엇보다 토요일을 제외하면 고기를 못 구워먹는 게 최대 단점.",4.0
달달잠,아주머니가 정말 친절하시고 한옥마을에서 좀 떨어져 있어서 조용해요,5.0
이가한옥,너무 좋았고 사장님이 친절하셨어요 근처 맛집도 다 알려주시고 정말 좋은 숙소였던거 같아요,5.0
이가한옥,숙박 얼만지 전화해서 물어보니까 검색하면 나오는거 왜물어보냐고 불쾌해하시는데목소리만 친절한척하는 말이나 행동은 너무불친절하시네요방음도안되고 방도좁고 이럴거면 모텔을가는걸 추천!,1.0
이가한옥,건축물은 좋음  위치도 한옥마을 라한호텔(구리베라호텔) 맞은편이라 구보이동  좋음내부 호실  공간이 두명이상 이면  사이즈가 약5평정도소음부분이 절대적 감안  하셔야함잠만  잔다  생각  하심  나쁘진  않음가격대가 조건에  비해  높은 편임직원분에 물품(수건.화장지.물 등) 보충이 많이 느림,3.0
이가한옥,주차도 편하고 사장님도 너무 친절하시고방도 뜨끈뜨끈 너무 좋아요^^무엇보다 동선이 한옥마을과 가까워서 좋습니다.화장품 기프트도 감사합니다.잘 쉬다 가겠습니다. ^^,5.0
이가한옥,1층 도로쪽 방은 창문 열면 지나다니는 사람과 인사가 가능합니다주차장쪽이었으면 창문도 맘껏 열고 좋았을텐데한옥 마을 접근성은 좋은데 같은가격이면 모텔을 추천해요,3.0
가원당한옥,위치 너무 좋았습니다. 맛집 길거리 음식점에서 가까운데 조용합니다. 가족실을 이용했는데 욕실에까지 온돌이 들어와 있어서 샤워하는 내내 행복했습니다. 안내 문자도 친절했습니다. 답변도 바로바로 주셔서 감사했습니다.,5.0
가원당한옥,한옥마을 메인도로인 태조로에 가깝고 아담하고 귀여운 집 다소 작게 느껴질 수는 있으나 신축이고 깔끔한 편이고 높은 층고를 이용해 다락이 있는 방들이 있어 공간적으로 좁다는 느낌은 다른집에 비해서 들지 않는다특히 바로앞에 정자와 작은 인공수로가 있는 공원이 있어서 다소 작을 수 있는 정원이 단점이 아닌집,5.0
가원당한옥,공간이 넓지는 않습니다 하지만 가격을 생각하면 나쁘지 않안 공간에 기본적인 어메니티도 제공되는걸 생각했을때 굉장히 합리적인 숙소입니다.,5.0
가원당한옥,일단 위치나 가격대비 너무좋음숙소가 좁긴하나 아늑하다할수있음 전체적으로 깨끗함  바닥은 뜨거우나 한옥이라 위풍은 있음다만 이불에서 냄새가나서 찝찝했음오래된 이불 아니면 묵혀둔 이불 냄새로 장점들을 다 커버해버림,3.0
가원당한옥,"한옥마을 안에서도 접근성이 좋았던 한옥스테이.경기전이나 전동성당이 근처고 저녁에 남부시장을 가기에도 동선이 나쁘지 않았다. 거리를 보면 저녁에도 많이 시끌벅적할 것 같지만 골목으로 살짝 들어오는거라 밤에 조용한 편이었다.다만 앞에 차를 댈 공간이 한대? 정도라 차량은 다른 곳에 주차를 하고 와야하는 번거로움은 있다만, 짐이 많지않다면 사실 별 대수가 되진않는다. 무료주차를 제공하는 곳이 있으므로 반드시 사전 확인을 주인에게 하고 가면 좋겠다.내부는 나쁘지않았고, 다만 그날 다른 방 2개에 가족 단체여행이었는지 많이 떠들어대서 조금 거슬렸던것만 빼면 만족스런 스테이였다. 화장실/욕실도 안에 별도로 있으니 편했고..가격도 비싸지 않은 편이어서 가성비 생각하면 가봐도 좋을것이란 생각이다",4.0
알콩달콩 다락방,전주 한옥마을 엄청 복잡한데  주차할수있는 숙소라서 좋았구요~~ 사장님 넘친절하세요 ~~ 방넘 따뜻했구요 조식도 넘 맛있어요 ~~숙소나 이불상태도 좋았구요 화장실이 넘작은게 좀 불편했네요 ~~ 사장님 잘알려주시고 친절하게 설명해주셔서 좋은여행이었습니다.,4.0
알콩달콩 다락방,두번째 오는곳인데 깔끔하고 쥔장이 친절하십니다,5.0
알콩달콩 다락방,깨끗하고 사장님께서 친절해요!길거리야랑 베테랑 코앞이고제휴서비스도 좋아요맨몸으로 오셔도 웬만한건 다 있습니다,5.0
알콩달콩 다락방,사장님 친절하십니다. 아침에 주신 샌드위치와 과일 잘 먹었습니다. 화장실이 너무 좁아서 좀 불편하고 준비된 이불로는 허리가 아파서 한장 더 요청했는데 바로 준비해주셨습니다.  침구류랑 방 상태는 깨끗한 편.10대 정도 주차가능한 주차장도 있습니다.,3.0
알콩달콩 다락방,사장님의 친절한 환대와 깨끗한 객실로 인해 전반적으로 만족하였으나 객실에 창문이 없고 화장실이 좁은것은 아쉬움,4.0
나무그늘,하룻밤 묵을 일정이면 선택. 가격이 괜찮음. 화장실이 증축한 추가공간 같은 느낌인데 화장실 문 열자마자 하수도 냄새가 심각하게 방으로 들어옴..,3.0
나무그늘,다락 구조의 방이 아늑함,5.0
새와나무,아주 만족했습니댜!,5.0
금농헌,최고의 한옥숙소,5.0
금농헌,한옥미을 가까운 숙소,4.0
사랑루,여행내내 비가왔는데 그 비 마저 고즈넉하게 소화하는 곳. 바로 옆에 느낌 좋은 카페가 있어서 한옥캉스 하기 좋은 곳. 대가족이 가서 요구사항 많았는데 관리자 분이 그래도 친절하게 응대해주셔서 좋았음,5.0
사랑루,화장실 등 숙소가 다소 불편하나 난방 및 주인 서비스는 좋았다. 하지만 가격이 너무 비싸서 재방문 의사는 없다.,3.0
사랑루,"한옥마을 안에 위치해서 근처 구경하기 좋음. 마루도 있어서 바깥 구경하기도 괜찮음. 조식으로는 오렌지, 방울토마토, 삶은계란이 제공됨. 잼과 버터가 있는데 빵이 없어서 아쉬웠음. 한옥집 특성상 옆방과 소음이 들림. 화장실과 샤워시설은 괜찮았음",4.0
사랑루,한옥을 체험하며 저렴한가격에 잠자기 좋아요. 조식도 포함인데 다른음식먹으려고 먹지는 않았어요한가지단점은 옆방tv나 얘기소리가 소리가 잘들리네요. 전반적으로 만족합니다,4.0
사랑루,방크기는 셋이서 자기에 적당햇어요~풍경은 넘 좋앗구~주인분들도 넘나 친절하셧어요 ㅎ에어컨도 잘되고 휴가 잘보내고 갑니당~,5.0
한옥숙박체험관,가격대비 좋습니다. 대략 하루에 6만원대에 예약하면 됩니다. 침구류나 방도 깨끗합니다. 방이 작아서 둘이 가서 쉬기 좋습니다. 다락이 있어서 아이들이 좋아할 수 있으나 가파른 사다리를 올라가야 해서 다소 위험합니다. 창호가 좋은지 방음도 잘 되는 편입니다.  마당이 넓어서 좋습니다. 들어가는 길이 예쁩니다.,4.0
한옥숙박체험관,깔끔하고 사장님께서 친절하셔서 정말 좋았어요.!! 약간 떨어져있지만 전용 주차장이 있는게 너무 좋았네요. 잘쉬다갑니다,5.0
한옥숙박체험관,한옥마을 중심에 있어서 위치가 편리하고 조식도 줘서 좋아요,5.0
한옥숙박체험관,친절하신 사장님과 아늑한 방..깨끗한 시설..맛있는 커피와 토스트 너무 좋아요..왕 추천합니다!,5.0
한옥숙박체험관,비교적 싸고 한옥 마을 한가운데라 어딜 가기도 편함. 다만 생각보다 많이 좁음.,3.0
김명옥김치숙박문화관,숙박시설이  너무  초라하고  미비했다  숙박요금도  너무 비싸다  추천해주고 싶은 미음 별로다,2.0
김명옥김치숙박문화관,커피포트 깨져있는지모르고 물데우다가 방에 물이 흐르고있었네요..전자레인지 데우는중이였어서 늦게봤어요..ㅎㅎ주차..처음 찾아간다면 무척어렵습니다..방은그냥저냥,5.0
김명옥김치숙박문화관,한옥마을 길건너 도로변에 있는데 한옥은 아님.대채적으로 객실 깨끗하고 직원분이 친절하심.,4.0
김명옥김치숙박문화관,"본관엔 방이 없어서 별관을 예약했는데,이건 별관이 아니라 완전 다른곳에 동떨어진 허접한 주택이었다.주차장도 없어서 사람들이 많이 오가는 인도 위에 주차를 해야했고 그걸 너무 당연시 하는 주인의 태도도 불쾌했다.과태료가 나오면 내줄테니 걱정말라며....우린 4인가족이라 4인실을 예약했는데 방은 2인실이였다. 문을 열어보니 바로 조그만 방이였고 그게 다였다. 그냥 여관방같은....구석에 화장실이 있는데 너무 좁아서 쓰기에 너무 불편했다.키가 187인 아들은 머리가 천장에 닿아서 똑바로 서있지도 못했다.남편이 인터넷으로 보고 예약했는데 아마도 본관의 정경만 나와있어서 별관이라해도 본채  바로 옆일거라 생각한거같다. 별관에 대한 사진이나 설명은 돈을 입금한 후에야 문자로 보내주었다.아들 입대전에 한 마지막 가족여행을 그런 곳에서 보내게 되어 정말 속상했다.",1.0
김명옥김치숙박문화관,김명옥숙박 숙박은 괜찮은편 방음은 별로 인듯하지만 저희만 숙박을 해서 조용하게 지내다옴숙박앞에는 무료주차,4.0
정가한옥,"시설이 깔끔하고, 사장님 내외분들이 친절하십니다.주차장이 있고, 한옥마을로 접근성이 괜찮습니다.2인실은 조금 좁은 느낌이 들지만 수면을 취하는데 지장없습니다.",5.0
정가한옥,장점:가격대비 깔끔하고 있을껀 다있다 두사람 하루 자고가기 좋다아침에 아름다운 아침을 맞이할수있다ㅡㅡㅡㅡㅡㅡㅡㅡㅡㅡㅡㅡㅡㅡㅡㅡㅡㅡㅡㅡㅡㅡㅡㅡㅡㅡ단점:외국인은 못잔다 허리 아프고 골반아프고 바닥 뜨거워서 잠자기 힘들꺼 같음 !바닥이 개뜨겁다 공기는 차다구막사 느낌,2.0
정가한옥,전주한옥마을 바로근처깨끗하고 아담해서 소음은 좀..숙박해서 한복대여도 할인~전주난장입장권도 할인주인여사장님 넘친절해서 기분좋았어요주차장이 있어서 👍 👍 👍,4.0
정가한옥,객실은 깔끔한데 작은편이구요~주인아저씨 엄청 친절하셔요~위치는 한옥마을 바로 건너편이라 접근성이 좋습니다~,5.0
정가한옥,따뜻하고 고즈넉한 한옥 느낌의 게스트하우스. 실용주의라서 공간은 딱 잠만 자기 좋아요~한옥의 정취가 느끼고 싶다면 좋습니다. 이불이 아삭아삭~잠이 솔솔~위치는 전주 한옥마을 구경하기 넘 좋아요~주차장도 있고 '더 정가' 호텔도 함께 하셔서 차마실 공간도 있네요^^,4.0
꽃잠,"주인분은 친절하고, 한옥마을 안에 있어 고즈넉하고 장소는 좋았다. 화장실은 깨끗하고 천장도 높아서 좋았고 한옥디자인도 괜찮았다.하지만 별점이 낮은 이유는, 방음이 전혀 안된다. 옆방에서 기침하는 소리 까지 다 들린다. 소리가 웅웅 난다 크다작다 수준이 아니고, 대화내용을 명확하게 들을 수 있는 수준이였다. 가족이여서 다행이지 신혼부부나 커플이 있었으면 어쩔려는건지.... 나오는길에 보니 방문후기는 전부 젊은 커플들이였다. 어떻게 사용했는지 모르겠다.",2.0
꽃잠,"무엇보다 주인 아주머니가 굉장히 친절하셔서 좋았습니다.체크인 시간보다 일찍 도착할 것 같다니까 일찍 체크인 도와주셨고, 도착하자마자 트렁크 바퀴 닦아주시고 짐을 옮겨주셨습니다. 이후 지도를 통해 볼거리, 먹거리 등을 알려주셔서 많이 참고했습니다. 방은 정말 아담하고 아늑했습니다. 다만 한옥이라서 방음이 안되고 화장실이 너무 좁아서 씻기 힘들더라고요..그래도 1박에는 큰 문제 없었습니다!",4.0
꽃잠,사장님이 너무 친절하시고 방도 2인이 쓰기에 아담하고 좋습니다. 깔끔하고 정말 정성으로 민박운영하시는게 느껴져여 다음에 전주가면 무조건 이곳에서만 잘겁니다,5.0
꽃잠,소박하지만 정겹고 깔끔한 숙소입니다. 무엇보다도 주인아주머니가 너무 친절합니다. 생수도 무료로 주시고. 방도 아기자기하고 이뻐요. 다음에 오면 또 묵고싶은곳입니다.,5.0
꽃잠,사장님 친절하시고 열씨미 설명해주시고기본적으로 깔끔하고 그 부분은 인정합니다근데 집이 골목끝에 들어가 있고방에서 화장실 하수구 냄새가 정말 심하게 납니다분명 화장실 리모델링 하시고 겉은 깨끗한게 맞는데냄새가 너무 심해서 화장실에서 자는 느낌이였습니다다른 방은 안가봐 모르겠지만참고로 수놓는 꽃잠 방이였습니다,2.0
아랑궐,객실은 침대밑 청소가 안되어있고목욕용품 구비는 좋았어요.샴푸 리스 바디 오일 수건까지~근데 방이 답다하니 다 막혀있었어요.너무 좁고 정원 넓고 마루있는집이 아니어서 아쉬웠는데 위치는 좋았어요.방이 다닥다닥 붙어있는 구조라 대화하기 조심스럽고 그랬네요.아침 커피랑 토스트도 있어 드시면 된다네요~,4.0
아랑궐,솔직히 한옥은 불편하다란 생각이 많앗는데여기가고 완전 바뀌었어요 ^^화장실 티비 보일러 에어컨 다 만족이엿고 가격도 저렴하고 골목안쪽에 위치해 있어서 조용했고 또 안쪽까지 들어가고 나오는걸 반복하니한옥마을에 온걸 실감될 정도로 너무 멋진 곳이엿습니다아침에 커피도 주시고 펜션지기 언니분 너무 친절하시고 이쁘셧어요 ^^,5.0
아랑궐,"방이랑 화장실은 괜찮은데 침구류가 너무 지저분했어요.머리카락, 음식물튄거, 핏자국 등. 베개 커버안쪽에 베개가 누렇고 침자국있었어요.",3.0
취락당,엄청 친절하셔요! 저희가 바쁘게 나가는 것만 아니였어도 널널하게 움직였을텐데ㅜㅜ 불편한 점 없는지 계속 물어봐주시고 방도 무료로 업그레이드해주셔서 편하게 지내다가네요~다음에 또 재방문 할게요!!,5.0
취락당,"공용주차장에서 가깝고,직원분이 친절하시네요.주변 볼거리나 식당도 잘 알려주고요.도움이 많이 되었습니다",5.0
취락당,화장실까지 바닥 보일러가 되어있어서 겨울에 따뜻하네요 ㅎㅎ 살짝 멀긴하지만(한옥마을5~10분거리??) 한옥마을가서 숙소 잡을때 여기 추천합니다.,4.0
취락당,"깨끗하고, 귀엽고. 골목에 있어 시끄럽지 않고, 공영주차장에서 가깝고. 불만스러운 부분이 없네요.",5.0
취락당,생각보다 훨깔끔하고 좋았습니다주인분도 친절하시고 한옥마을내에있다보니 좋았어요!,5.0
옹기종기,사실상 한옥마을 내부에 있다고 봐도 될 정도로 가깝고 공영주차장과도 가까워서 주차하기도 편했어요. 온돌방은 따뜻했고 골목에 있어서 그런지 버스킹 소리는 안들리고 조용해서 좋았습니다,5.0
옹기종기,"진짜 깨끗하고, 방도 갬성 가득^^재방문 의사 있습니닷!ㅎ",5.0
벼리채,고즈넉하니 너무 편하고 깨끗했어요~주인분도 과하지안게 딱 편히쉴수있을정도로 신경을써주시고 아주좋았습니다~ 전주내려갈때는 항상 여기에  머무를 생각입니다~^^,5.0
벼리채,이곳 벼리채...!  하면 떠오르는 것들...1)  너무너무 친절하고 정감 있으신 주인 내외분2)  주인 닮아 사람을 너무 좋아하는 강아지 같은 고양이3)  전통가옥4)  정원이 있는 예쁜 한옥집반려동물 동반이 가능하고 전주 한옥마을과는 개천을 사이에 두고 있어한옥마을과의 접근성은 용이하면서도 번잡하거나 시끄럽지 않아 평안한 휴식을 취할수 있는 잇점이 있다.,5.0
벼리채,낡았지만 주인께서 열심히 관리하시고 정감있는 느낌 덕분에 잘쉬고왔습니다아침식사를 정성스럽게 제공해주셔서 좋았습니다,5.0
벼리채,일단 대형견 친구들도 숙박이 가능해서 좋았고 사장님도 친절하시고 방도 깨끗하고 있을꺼 다있어요! 한옥마을과도 가까워서 좋아요,5.0
벼리채,주인 분들이 친절하시고 고양이가 귀엽습니다. 기르시는 동물들이 있기에 동물 좋아하시는 분들에게 추천합니다.,5.0
늦잠,현대식 시설.다과무료체험.정수기시설.침대메트리스도 시몬스 최고급으로.스크린TV.드립커피까지 배치 되어 있습니다,5.0
늦잠,조심스런시기에 조용히 머물며 잊지못할 따뜻한 추억을남기고싶은분께...,5.0
늦잠,전주의 편한안 숙소힐링을 할수있는 숙소,5.0
늦잠,편안하게 하루 잘 쉬다왔음,5.0
늦잠,깔끔하고. 조용. .,5.0
