,name,review
436,경기전별당채,"사장님이 너무 친절하셔서 좋았어요! 짐을 오전10시라는 이른시간에 맡기러갔는데 친절하게 맡아주셨고 문자로 식당, 볼거리 추천해주시고 너무 좋았어요. 숙소가 한옥마을에 위치해있어서 숙소에서 쉬다가 구경하러가기 좋았고 보일러로 온도조절가능하고 이불깨끗하고 뽀송하고 숙소 문을 열면 너무 이쁜 풍경이 보이는점도 좋았어요. 제가 묵을땐 옆방이 비었을때라 소음도 그닥 안들렸고 방도 은근 넓어서 한방에 셋이서 누울수 있는 정도였어요. 저렴한 가격에 너무 만족스러웠어요"
437,경기전별당채,아들과 남조카 같이 가기로 했는데 아들이 일이 생겨 못가고 조카하고만 갔어요.3시 40분쯤 도착하니 방도 따뜻하게 데워져서좋았어요. 문자로 주변 둘러볼곳 알려주셨는데 다 돌아보지 못해 아쉬워요.화장실과 붙어 있는 방이 더워서 온도 낮췄는데다른방은 바깥문쪽이라 외풍이 좀 있는거 같은데조카가 춥지 않았다네요.준비해주신 조식도 맛 있었어요.왱이집에서 할인도 받았서 좋았고요.1박 아쉬워서 하루 더 머물까 하고 검색하니 방 전부 예약마감 떠서 그냥 왔어요. ㅠ잘 이용했습니다.^^
438,경기전별당채,안녕하세요 사장님 대면세미나로 인해 매주마다 내려가는데 친절하게 해 주셔서 감사합니다. 전주 한옥마을에서 갈볼만한 곳 추천해주셔서 감사하고 너무 친절하시고 지인들에게도 추천 많이 하고 있어요!! 다음주 금요일에도 내려갈께요❤️
439,경기전별당채,"어머니 모시고, 동생 식구들과 총 10명 머물다 왔습니다. 사장님께서 사전에 이것저것 자세하게 알려주셔서 주차도 쉽게하고, 한옥마을 맛집이나 즐길거리 별 고민 없이 잘 먹고 즐기다 왔습니다. 대가족 여행 계획중이신 분들께 강추에요!!"
440,경기전별당채,사장님 안녕하세요 3년전 여름 경기전별당채에 머무르고 인상이 매우 남아 올해 대면세미나 및 휴식차 게스트하우스에 예약해 너무 좋았습니다. 게스트하우스 너무 좋고 친절해서 다음에도 또 오고 싶어요
441,더머뭄,"더머뭄! 4년전 좋았던 기억으로 한번더 방문했습니다. 한옥마을안에 있어 먹거리, 볼거리,입을꺼! 그리고 조식까지!! 완벽합니다ㅎㅎ 그리고 한복은 사장님께서 소개시켜준곳에서 대여해서 예쁜추억 많이 남기고 돌아왔습니다~ 그리고 난방무지 잘되니 무턱대고 틀면 안된다는거ㅋㅋㅋ 다음에 기회되면 꼭 다시여행갈께요~ 사장님 내외분도 건강하세요~"
442,더머뭄,"전주한옥마을에서 1박하려고 예약했어요~사장님 부부 두분 너무 다 친절하시고, 저희 어머니 아버님도 무척 좋아하셨습니다.전주한옥마을안에서 아기자기 예쁜 숙소로 최고입니다!!재미있게 잘 놀다왔습니다^^ 다음에 전주 갈 일 있으면 또 예약할게요~"
443,더머뭄,전주여행 즐겁거 잘다녀왔어요!사장님 넘 친절하시고 미리 주차장 안내도 다해주셔서 수월하고 또 공용주차장에서 거리도 가까워서 정말 편했어요~^^아침부터 대접 받는듯한 정성가득한 조식 잊지 못할것같아요! 아이가 감기기운 있다니 방온도조절부터 다 챙겨주시고 특히 침구에 예민한편인데 깔끔한 상태가 너무 만족스러워 푹 잘수 있었던거 같아요~ 다음 전주 여행도 더머뭄에서 지내고 싶네요^^
444,더머뭄,더머뭄 숙소 정말 힐링도 하고 재밌게 보내다 갑니다 :) 숙소 깨끗하고 관리를 정말 열심히 하신게 눈에 보여요 ! 조식도 푸짐하고 과일이 거짓말 안치고 다 맛있었습니다 ! 난방도 너무 잘되고 귀여운 고양이들은 덤으로 함께 :) 가장 좋았던 것은 사장님 부부가 너~~~무 친절하셨어요 ! 반갑게 맞이해주시고 정말 편하게 해주셨습니다- 또 전주에 놀러간다면 저는 더머뭄에 무조건 올거예요 :)
445,더머뭄,친절하게 설명해주시고 주변 관광명소 지도 안내 해주셔서 좋았어요 한복대여 같은것도 꿀팁알려주시고 아침 조식은 생각보다 너무 고급지고 푸짐해서 놀랐습니다 떡도 과일도 너무 신선했구요 아이들이 있어서 찰밥 챙겨주신것도 정말 배부르고 맛있게 먹었습니다 👍 편안하게 잘 쉬었습니다
446,더머뭄,딸래미랑 조용히 잘쉬고 왓네요사장님께서 엄청 친절햇고 조식이 참좋았네요사장님아주 잘쉬엇다 갑니다
447,더머뭄,"위치좋고, 친절하세요! 한옥에 자고 싶다는 아이들때문에 예약했는데 만족스러웠습니다.^^조식에 나오는 다양한 과일에 입이 떡 벌어졌어요~ 한옥이다보니, 방음이 안되고, 화장실도 작았지만 그럼에도 또 가고 싶은 곳입니다."
448,더머뭄,사장님께서 친절하셨어요 : ) 방에 입실할때 관광지도 준비해주셔서 손수 맛집위치 표시해주시구 감동했지 뭐에요 ❣️굿굿 방이 아늑하고 깨끗했구요 ㅎ난방도 아주 뜨끈뜨근해서 할머니댁에 온것처럼기분을 받았어요 : ) 무엇보다 위치가 가까워서투어하시는 부분에 너무 편해서 좋았구요 부부사장님께서 아침 조식을 함께 준비하셔서 챙겨주시고너무 감사했습니다 위치적으로 오시기에 편하고돌아다니면서 가까운점 크게 매리트를 받았어요🙂 무쪼록 예약할당시 어려움이 살짝있었지만 사장님께서 친절히 잘도와 주셔서 그점도 감사해요
449,더머뭄,4인 가족여행으로 다녀왔는데 예약한 방보다 더 넓고 좋은 방으로 무료 업그레이드도 해주셔서 너무 편히 잘 쉬다 가요! 한옥건물이 참 예쁘기도 하고 깨끗해서 더 좋았어용~ 조식도 예쁘게 잘 차려주십니다 ㅎㅎ 전주에 여행갈 일이 있다면 더머뭄 완전 추추추천이에용💛친절하신 사장님 덕분에 전주에서 좋은 추억 만들어갑니다!
450,더머뭄,사장님 부부께서 엄청 친절하셔요!! 신경도 많이 써주셔서 엄마랑 잘 쉬고 왔습니다 다음에도 무조건 숙소는 요기로 올 거예요💜 보너스로 귀여운 꼬양이를 볼 수 있어서 좋았어요!
451,돼지꿈한옥숙박,엄마 모시고 두번째 방문한 돼지꿈 !1층에 머물렀을 때 2층 테라스가 아쉬워서 이번엔 2층으로 예약했습니당사장님도 항상 친절하시고 숙소도 깨끗하고 이번에도 잘 머물다가 갑니다 :)
452,돼지꿈한옥숙박,저희가 네식구라 방이 생각보다 좁았지만 거의 잠만 자야했기에 만족했고요. 연식이 있는 듯 하지만 비교적 깨끗했고 하룻밤 지내기 좋았습니다. 특히나 주인 아주머님의 친화력 최고! 우리 엄마같았어요. ^^ 넘 친절하시고 손수 준비해주신 조식! 맛있게 잘 먹었습니다. 딱 좋은 구성이었어요. 전주에 온다면 다시 오고 싶은 곳입니다.
453,돼지꿈한옥숙박,"깨끗하다는 리뷰 보구 선택한 곳인데 사장님이 깨끗하게 관리 잘하신거 같아요.조식도 아침에 새로 한 떡과 갓 삶은 계란,토스트,우유,쥬스,커피 등 든든하게 먹고왔어요.방음이 잘되는건지 밤새 조용했어요.아이가 다음에도 또오자 하네요."
454,돼지꿈한옥숙박,"예전에 당일치기로 다녀왔던 전주여행이 아쉬웠던 기억이 있어서 이번에 1박2일로 다녀왔습니다. 근처 한옥숙박업소 검색 정말 많이해서 이곳을 선택했는데 결론적으로는 정말 잘한 선택이였던거 같네요. 가격도 괜찮고 조식도 사장님이 손수 만들어서 주시는데 정성이 느껴지는 식사였습니다. 무엇보다 아이들이 실수해서 침구류 오염시켜서 배상해드려고 말씀드렸더니 오히려 괜찮다며, 여행왔는데 기분전환하라고 말씀해주시던 사장님의 인품에 감동받았습니다. 저희 가족모두 사장님 덕분에 즐거운 추억 만들고 왔습니다. 다음에 기회되면 꼭 다시 방문드릴께요. 감사합니다."
455,돼지꿈한옥숙박,2층에서 보는 한옥마을 뷰가 참 이뻤어요ㅎㅎ 조식도 맛있고 사장님도 친절하셨어요^^ 침구도 편하고 깨끗했고요♡
456,돼지꿈한옥숙박,2박3일로 잘 머물다가갑니다~ 여행을 자주 다니지못해서 이번에 숙소도신중히 선택했는데 잘한선택이었어요~ 주변에 볼것도많고 여유롭게 아무생각없이 쉬었네요!데이트하기 좋았고 팔을다쳐서 붕대를 칭칭말았 지만 불편함없이 아픈것도 잊고 지낼수있었습니다~☆나중에 전주를다시찾을때 뵙겠습니다 사장님~~좋은추억 편한숙소 그리고 아침에 이틀먹엇던조식 마음따뜻히 여행마무리합니다 또만나욤♡_♡!!
457,돼지꿈한옥숙박,"야경뷰에 반해 돼지꿈 국화방 1박했습니다♡대만족이었어요~ 다른곳보다 방음도 잘되구 방도 따뜻하고 청결했습니다^^엄마랑 뚜벅이 여행이었는데, 체크인전, 체크아웃후 모두 흔쾌히 짐보관 해주셔서 너무 감사했어요~^^ 조식도 챙겨주시구~ 아침에 갓만든 떡 너무 맛있었구요~ 기분좋은 추억남기고 잘쉬고왔습니다😄"
458,돼지꿈한옥숙박,아침에 일어나서 문 열었을때 보이는 풍경이 너무 예뻤어요 바람에 흔들려 은은하게 울리는 종소리에 마음이 편안해지고 조용하게 잘 쉬다가 왔네요^^ 사장님도 너무 친절하시고 조식에 있는 직접 만드신 떡도 정말 맛있었어요!
459,돼지꿈한옥숙박,"너무너무 좋았습니다!주인 아주머니의 푸근함에 너무 감사했고,물가가 너무 비싼 요즘 죄송 할 정도로 퀄리티 있는 조식에 정성과 사랑까지 담아 주셔서 맛있게 먹었습니다.아이들을 4명이나 데리고 가서 눈치가 좀 보일까 싶었는데 이해해 주시고 예쁘다 해주셔서 마음 편하게 잘 자고 왔고요.한옥마을 골목에 위치해 있어서 이동하기도 편하고 주차장도 너무 가까워서 최상이였습니다.한옥마을에서 3번째 숙박인데 2층은 처음이라 그 매력에 사진을 얼마나 찍었는지 정말 배경이 너무 예쁘게 잘 나왔답니다.아무튼 정말정말 잘 지내고 따뜻하게 쉬다 왔습니다.아이들이 다음에 또 오면 돼지꿈으로 오자고 !!"
460,돼지꿈한옥숙박,"저는 1인실인 해당화에서 혼자 하루 숙박했습니다🤗입구에 들어섰을 때부터 숙소가 진짜 너무 예뻐서 신났습니다ㅋㅋ리뷰로 알 수 없었던 것들을 조금 남겨드리자면,1. 침구가 굉장히 뽀송뽀송하고 깨끗합니다! 아침에 일어났을 때도 빨래가 새로 널려있더라구요2. 문은 이중창으로 이루어져있어요. 사진으로 봤을 때는 창호지로 된 문틀만 보여서 혹시 문이 안잠기나...?하는 걱정을 하고 갔는데 이중창이라서 안전하고 바람도 안들어오니 안심하셔도 될 듯 합니다. 커튼도 있어서 바깥에서 보일 일은 절대 없습니다! 3. 화장실도 깨끗합니다! 화장실 입구에 문턱이 좀 있어서 바깥으로 물이 안새어나오는 것도 좋았어요ㅎㅎ조식도 셀프인데 저렇게 직접 가져다주시고 정말 사장님이 너무 친절하십니다😭 또 방문하고 싶어요!!"
461,큰주댕이,2박 잘 자고 왔습니다 아침마다 감동 조식이었습니다 집 주인 내외분의 따뜻한 환대 덕분에 더욱 편안하게 지냈습니다 딸이 외국 친구들에게 선물한다고 작가님 작품 구입했어요 서학마을 갤러리도 멋졌어요 댕이와 쥬디 만드시며 항상 웃음 가득한 나날 되세요
462,큰주댕이,어린이날 연휴로 2박으로 다녀 왔어요. 비가와서 여기저기 다니지는 못했지만 나름 아들이 좋았다고하네요.전주는 두번째 방문이라 숙소는 리뷰좋은 큰주댕이로.. 역시 소문대로 조식짱 사장님내외분들도 너무 친절하시고 편식쟁이 아들도 살뜰히 챙겨주셔서 감사했습니다. 제가 머문 룸 창을 열고 비오는 한옥마을 골목도 운치있게 감상도 했네요. 화장실도 침구도 깨끗하고 다 좋은데 한가지 아쉽다면 매트리스깔려있는 침상이 삐걱삐걱소리가 나서 저처럼 예민한분들은 좀 신경쓰이실수 있을 것 같아요. 장점 한가지 더 숙소가 한옥마을 여기저기 다니기 딱 안성맞춤에 위치해 있어서 다니고 좋았어요. 너무 편히 조용하게 쉬다가왔어요. 사장님 감사했습니다~^^
463,큰주댕이,"어버이날 끼고 2박3일 묵었습니다. 도착하자마자 친절한 사장님 설명덕에 한옥마을을 제대로 즐길 수 있었습니다.  맛있는 먹거리와 술 그 이상으로, 다음날 오전에 제공해주는 조식은 최고였습니다. 다음번에 다시오지않을 이유가 없네요."
464,큰주댕이,"누가 나를 위해 아침 차려준다는 건참 행복한 거 같아요.아이들 데리고 여행 가서 눈치 보며 지내다 올 거라 생각했는데 환대해 주셔서 감사했어요.다음엔 어른들 모시고 꼭 다시 방문할 거예요.생각 외로 방음 잘되고 수건도 뽀송했어요.그리고 주인분 내외가 너무 친절했어요.아이들 집 오자마자 또 가자고 아우성이네요.다음엔 좀 더 넓은 방, 쿠셔닝 좋은 침구에서 머물다 가려구오^^"
465,큰주댕이,일하는 동료분 추천으로 갔다온 곳인데 너무너무만족합니다 특히나 조식도 조식이였지만 깔끔쟁이 엄마가 흡족해하던 뽀송한 수건이며 이불까지 추운 겨울에 또 한번 가고싶은 만큼 풍기는 편백나무 향까지 다 너무 좋았습니다
466,큰주댕이,첫 전주여행을 너무나도 행복하게 보내게 해준 큰주댕이☺️사장님부부 너무너무 좋으시고방도 깨끗 침구류도 좋은 향기만 나고 편안했어요!리뷰에 조식 사진들 보고 좋다 생각했었는데직접보니 정말 입이 떡 벌어졌네요👍왜 이곳을 추천하는지 알겠더라구요~!친정부모님과의 여행 알차고 기분좋게 보내고 왔습니다🙋u200d♀️두번세번~열번 가세요!!!
467,큰주댕이,"침구 깨끗하다는 평을 보고 결정했는데 탁월한 선택이었습니다. 침구와 화장실이 정말 깨끗하고 쾌적했습니다. 2층엔 온수매트 있어서 따뜻했고 1층도 뜨끈뜨끈해서 이틀 간 네 식구 지내기 안락했어요. 경기전이나 기타 한옥마을 내 장소와 맛집을 모두 걸어서 다닐 수 있어서 편리했습니다. 사장님 내외분도 친절하셨고 정성가득한 조식은 너무 감동이었지요. 커피,과일,떡,달걀,고구마, 밤 등등 다 맛있게 잘 먹었습니다. 감사합니다. 그리고 큰주댕이 작품들 구경하는 재미도 있었습니다. 아이들이 좋아해서 기념으로 사왔는데 집에 두니 계속 전주 여행이 생각나서 즐겁습니다. 전주 한옥마을 여행이 다 즐거웠는데 숙소가 좋으니 편안해서 모든 것이 술술 잘 풀린 것 같아요. 사장님 번창하시고 건강하시고 행복하세요!! 감사합니다^^"
468,큰주댕이,아이들이 너무 좋아했어요바닥도 따뜻하고 화장실도 깨끗하고 복층이라 애들이 왔다갔다하며 즐겁게 놀았습니다조식은 말모말모💙❤️
469,큰주댕이,"갑자기 취워졌었는데 따뜻한 방에서 잘 쉬었다가 갔습니다~ 오자마자 반갑게 맞아주시고, 다음 날 맛있는 조식 먹고 기분 좋게 아침을 시작할 수 있었습니다!! 다시 전주에 가게된다면 여기로 올거에요(•ө•)ෆ⃛"
470,큰주댕이,"전주여행 여러번이지만 이렇게 온가족 만족도가 큰 숙소는 처음이었어요. 일단 주차하는거부터 너무 섬세하게 신경써 주셨어요. 방문한때가 주말이라 공용주차장이너무 혼잡했는데 골목에 주차하고 와도 된다고 안내해 주셨고, 주차하고 숙소에 도착하니 안전한 장소에 주차했는지 확인까지 하고 와주신 세심함에 첫번째 감동😀.아무래도 여행객들이 많이 찾으니 고객맞춤형 추천 맛집 및 동선 브리핑까지~ 약간 반신반의했던 식당이 있었는데 사장님이 현지인 입맛으로 검증해주셔서 안심하고 갔고, 만족스런 식사 했습니다^^숙소도 복층구조라 4인가족 머무르기에 불편함 없었고, 다음날 조식에서는 단언컨데 제가 아는 과일은 총집합이라해도 과언이 아닐정도로 훌륭하게 대접받았습니다. 다음 전주여행이 또 있다면 꼭 재방문 의사 있습니다!"
471,이재,"우선 한옥마을 가운데 위치하고 있어 위치적 장점 있습니다. 입구가 좁고 너른 마당은 없으나 숙소는 조용하고 전통모습 그대로 간직하고 있으며, 나무와 잘 어울려 한옥의 아름다움을 그대로 느낄 수 있습니다. 침구와 구비물품은 한결같이 깨끗했고, 예약단계부터 퇴실까지의 운영자분의 친절함이 1박이었지만 충분히 힐링이 되었습니다.조용히 나만 알고 싶은 곳이기는 하나, 이런 숙소가 잘되어야 한다는 생각에 리뷰 남깁니다.저도 딸램도 모두 행복한 하루였습니다. 감사합니다.다만 아쉬운 건… 간판이 눈에 잘 안띄어요. (철재 간판으로 숙소이름만 조각하여 밤에는 노란 빛이 하늘거리며 새어나와 이것마저 감성이라 생각할 수 있겠다 싶었지만, 앞 숙소의 불빛이 너무 강해서 자세히 보지 않으면 잘 안보여요)"
472,이재,사장님엄청친절하세요!방이좁다며걱정해주셨는데 게스트하우스라서감안했던거라 괜찮았습니다!침구가중요해서 리뷰가좋아서예약했는데방과침구모두깔끔해서 좋았습니다!!네이버리뷰가높은이유가있네요:)
473,이재,"사장님께서 이용전날 친절하게 안내문자도 보내주시고, 다과도 정성스럽게 챙겨주셔서 감동이었어요..ㅠㅠ 침구가 엄청 편해서 잠도 푹 잤고, 아침에 일어났을때 창가로들어오는 햇볕이 참 동화속 같았어요.. 그리고 연락드릴때마다 빠르게 답변 주시고 배려해주신 덕분에 첫 전주 여행을 편히 잘 머물다 갈 수 있었습니다! 정말 너무너무 감사드립니다 :) 추천해주신 맛집도 너무좋았고 비록 다 가보진 못했지만 다음번에 또 와서 방문해보고 싶네요! 복 많이많이 받으시고 커피도 잘 마실게요! 감사합니다!!"
474,이재,사장님 너무 친절하시고요♡(뵙지는 못했지만)숙소가 깨끗하고 아늑해서 편하게 잘 쉬었어요😊 침구도 새하얗고 뽀송뽀송해서 좋았어요^^
475,이재,"숙소가 너무 예쁘고 위치도 너무 좋아요ㅎㅎ 한옥마을 중심에 있으면서도 북적한 번화가랑은 거리가 있어서 조용하고 편안한 분위기입니다! 침구도 깔끔하고 포근해서 너무 좋았습니다 사장님께서도 친절하시구 다과상을 주셨는데 사진은 못 찍었지만 과일이 하나 같이 전부 맛있어서 어디서 구매하시는지 여쭤보고 싶었어요ㅋㅋ 숙소 분위기, 아늑한 침구 덕에 제 방에 있는 것처럼 편하게 잘 쉬고 갑니다 :) 다음에 전주에 또 오게 되면 망설임 없이 또 머물 것 같습니다 감사했습니다!"
476,이재,옛날 외갓집 분위기 따뜻함이 느껴지는 주인장의 설명도 좋구 편안함이 좋은곳입니다.
477,이재,아담하면서 운치있고 조용하고 분위기있고 다했습니다! 침구도 너무 좋고 깨끗해고 화장실이나 방도 정말 깨끗했습니다~! 최고였어요!!
478,이재,다과상도 준비해주시고 숙소 이용도 친절하게 설명해주시고 편의를 많이 봐주셔서 너무 잘 쉬고 갑니다.고즈넉한 분위기에 난방도 따뜻하게 해주셔서 방에만 있고 싶을만큼 좋았어요!
479,이재,"사장님이 정말 너무 친절하시고 웰컴프룻, 조식과일 등을 챙겨주셔서 너무 좋았어요! 제일 작은 방을 택했는데 2명이서 쓰기 무리없었어요. 다만 화장실은 작은 편이라서 몸집이 조금 크신 분들은 불편할 수 있을것 같습니다. 침구가 무척 깨끗해서 좋았고 사용하는 동안 먼지한톨 발견하지 못했습니다~! 관리가 아주 잘 되고 있는 거 같아요. 난방 무척 따뜻하게 해주셨고 다만 한옥 특성상 창문쪽은 바람이 새어들어와서 잘때 조금 추울 수 있습니다. 조용하고 고즈넉한 휴식을 원하시는 분들께 추천드립니다!"
480,이재,정성스럽게 준비해주신 침구와 음식으로편안하게 잘 쉬고 왔어요다음에도 꼭 다시가고 싶어요
481,한옥솔솔,첫 전주여행이라 한옥숙소에 묵고싶어서 다녀왔어요 시설도 너무 깨끗하고 사진보다 더 넓고 무엇보다 사장님이 넘 친절하셔서 기분좋은 여행을 하고왔네요~ 한옥구조상 방음은 진짜 취약했지만 사장님께서 응대를 잘 해주셔서 잘 쉬다왔네요 😀 낮에도 이쁘지만 밤엔 더 이뻤던 숙소였는데 또 가고싶어요!!
482,한옥솔솔,경기전 옆에 있어서 택시타고 들어가기 쉬웠어요. 한옥마을 안에 있어서 주변 관광지 가기도 쉬웠어요. 사장님도 친절하셨어요. 조식도 저렇게 챙겨주셔서 잘먹고 이동이 가능했어요. 보일러도 빵빵해서 간만에 뜨뜻한 방에서 푹 잤네요.
483,한옥솔솔,너무너무 친절하시고 시설도 깨끗하구 조아요.외국인 친구랑 갔는데 정말 재밌고 편하게 쉬다가 왔습니다. 그리거 숙소가 경기전 근처라 더 좋은 것 같아요! 다만 아쉬웠던건 방에 작은 식탁이 없어서 야식 먹는데 방바닥에서 먹었어용. 저희가 못찾은건지 모르겟지만 간이로 하나씩 있으면 좋을 것 같ㅌ아요 ㅎㅎ+ 아침에 조식도 주시고 넷플도 이쒀요 ㅎㅎ 편히 쉬다 갑니다 !! 나중에 기회되면 여기로 또 올 것 같아요😊
484,한옥솔솔,"18개월 아기랑 편히 잘묵고 왔습니다. 한옥인지라 방음부분은 감수했지만, 생각보다 같이 머무시는분들의 배려덕에 푹 잘쉬다왔습니다. 조식으로 주시는 과일, 떡도 맛있었고 사장님이 너무 친절하셔서 또 방문하고 싶습니다:) 아기랑의 첫 여행에 좋은 추억 만들어주셔서 감사합니다!!"
485,한옥솔솔,애기들이랑 한옥마을 걸어다니면서 그안에서 편하게 움직이고 싶어서 예약했는데 넘 만족스러웠어요. 위치도 한옥마을 딱 중간에 있어서 돌아다닐때 넘 좋았어요. 방도 넓고 깔끔했구요! 이중문 닫고 암막커튼까지 치니까 우풍도 심하지않고 온도 딱 좋았구요~ 한옥 특성상..방음이 잘 안되는건 알고가서 괜찮은데 ㅋㅋ 옆방 분들이 10시 넘어서 매너타임인데도 새벽까지 떠드시는 목소리가 ㅠㅠ 대화내용까지 다 들려요..ㅜㅜ저희는 예민한편이 아니라서 친구들끼리 놀러와서 그럴수도 있지~ 하고 말았는데 예민하신 분들은 힘드실수도 있을것같아용... 조식도 넘 예쁘고 맛있었고 간단하게 아침 먹기에 딱이었어요!! 너무 만족스러웠습니다~ 전주 여행오면 또올것같아요~!!
486,한옥솔솔,깨끗하고 조용하고 쉬기 좋았어요~ 사장님도 친절해요~
487,한옥솔솔,너무 편하고 따뜻하게 잘 쉬다 왔습니다!경기전 바로 옆이라 어디로 가도 접근성 너무 좋아요그리고 아침에 가져다 주신 떡과 과일 조식 너무 맛있었어요!하루종일 많이 걷다가 들어갔는데 방바닥도 너무 따뜻하고 온수도 잘 나와서너무 좋았어요! 너무 친절하게 대해주시고 다음에 또 전주 방문한다면 들르겠습니다!
488,한옥솔솔,"위치가 너무너무너무 좋았어요. 경기전 코앞이고 한옥마을 중심부!!사장님 친절하셨고, 떡과 과일로 구성된 아침식사는 너무 맛있고 든든 했습니다.아쉬운 점은 수납장처럼 생긴게 원래 싱크대 위치였던것 같은데 배수관 냄새가 조금 났어요.방에서 나갈 때마다 환기 시켜두니깐 괜찮더라구요.다른방은 괜찮을 것 같습니다.다음에 가면 또 들를것 같아요 ㅎㅎ"
489,한옥솔솔,사장님도 친절하시고 조식도 챙겨서 주셔서 편히 잘 쉬다 갑니다 한옥마을 내에 위치에서 정말 즐길거리가 많은 위치에요! 다음에 전주가면 또 한옥솔솔에서 숙박하고싶어요
490,한옥솔솔,사장님이 친절하셨고조식도 잘 나와서 먹었어요
491,청나루,어린 아이둘이랑 함께갔구요 저녁에 오니 공용주차장에 줄안서고 바로 들어갔네요^^ 사장님도 너무 친절하시고 방바닥 따뜻해서 잘잤어요~~! 숙소인근이 한옥마을을 한눈에 구경할 수 있어서 너무 좋은 것 같아요!
