,name,review
1121,뜨레가,"한옥마을 내에서 비교적 가격도 저렴하고 어메니티도 전부 구비되어 있어서 너무 만족스러운 숙박이었습니다.한옥마을 입구나 전동성당과는 거리가 좀 떨어져있지만 멀지않아 한옥마을 내 구경하며 충분히 걸어갈 수 있으며 오히려 더 조용해서 머무르기에도 너무나 만족스러웠습니다.방은 다소 좁다고 느낄 수 있지만 둘이서 취침하는데는 충분하고, 화장실이 방 안에 바로 이어져 있어서 민망할 수는 있지만 이용하는데 불편함은 없었습니다.사장님께서도 아침부터 부지런히 조식 준비해주시고 퇴실이나 짐 안내도 친절하게 해 주셔서 편하게 잘 머물다 왔습니다!특히 숙소 정원도 잘 가꿔 두셔서 마루에서 정원뷰힐링하고 편히 쉬다 올 수 있었습니다."
1122,뜨레가,조용하고 한적해서 마당정원에서 힐링타임 좋아요~ 사장님 넘 친절하시고 주말 아침조식 과일도 챙겨주셔서 좋았어요~ 방도 깨끗하고 따뜻했습니다U0001faf6
1123,뜨레가,리뷰가 적어서 걱정했었는데 완전 좋았어요!! 방크기도 알맞고 화장실 컨티션도 괜찮고특히 조금 쉬는시간이 있을 때 마루에서 멍때리는것도 좋았네요 ㅋㅋㅋ 밤에 산책하기 좋은곳에 위치해있어서 그것도 좋았어요 ㅋ..ㅎ 너무 칭찬만 하는것 같지만 다 사실입니다 ㅋㅋㅋㅋㅋ😆 전주 놀러갈때마다 묵을것 같아요! 사장님도 친절하세요~
1124,숨,햇살이 잘 들어오는 마당부터 아늑한 방까지 정말 편하게 쉬다가요! 난방이 잘돼서 따뜻하구 화장실도 큼직하니 좋았습니다. 그리고 방 들어오자마자 나는 향긋한 냄새와 깔끔한 침구에 기분이 좋더라구요 ㅎㅎ 사알짝 아쉬운게 있다면 작은창이 없다는거?! 환기시키고 싶을때나 공기가 답답하다 느껴질때 열수있는 창이 있었으면 하는 아쉬움이 조금 있었습니당~
1125,숨,야경도멋지고 공간도 좋았어요. 침구도좋았고 화장실도 쾌적하고 깨끗했어요.찜질방처럼 뜨끈한것도 좋더라구요그러나 약간 개선됐으면 하는점은1. 방문이 불투명해서 바깥공용거실 불이 환하다보니 어머니가 잠을 못주무셨어요...ㅜㅜ옷으로 가리고 했다고하더라구요.바깥불은 몇시이후로는 자동 소등되면 좋을거같아요. 2. 2층 테라스 참좋은데 의자가 너무나 녹슬어서 ...ㅋㅋㅋ 앉기가 꺼려졌어요... 의자한번 바꿔주시죠 ... 3. 방에 뭔가 정체를알수없는 꿉꿉한냄새가 좀 났어요. 차라리 화장실에는 안나는데 왜그런지 원인은모르겠지만 ? 이것도 개선되면 더 좋은숙소가될듯해요 잘 쉬다 갑니다
1126,숨,"깨끗하고 깔끔했습니다. 침대가 있는 점과 온도를 단독으로 조절할 수 있는 점이 좋았어요. 그리고 위치도 강, 한옥마을, 남부시장과 가까이 있어 산책하기도 좋았습니다. 오래된 건물과 나무 때문인지 조금의 냄새가 나지만 나쁜냄새이지는 않고 금방 적응되어요. 일회용 칫솔과 치약이 제공되는 점도 좋았고 무엇보다 주인분이 친절하셔서 기억에 남습니다."
1127,숨,주변이 조용해서 이용하기 좋았어요!방음이 안되거나 좁다는 후기가 많았는데 이해가 되는 부분이었고 이 가격에 아쉽지 않았습니다!사장님도 친절하셨고 조기 체크인도 해주시구전체적으로 내부도 엄청 깨끗하고 컵도 다양해서 좋았고 체크인 시에 주변 맛집 알려주시는 센스에 감동 !
1128,숨,깔끔하고 개인화장실 있어서 너무 좋아요!!방이 좁긴하지만 어차피 누워서 쉬다갈거니까ㅎㅎ 침대가 넓어서 좋았어요!! 다음에 또오고싶네요👍🏻
1129,숨,미니멀한 둘만의 독채라는 느낌이 많이들었습니다 숙소보다는 잠시 집을 빌려서 묵은 느낌이라서 뭔가 더 포근했어요 조명또한 센스있게 곳곳에 비치되어 분위기가 한것 살아났습니다 전주한옥마을에 오신다면 꼭 묵어보시는걸 추천합니다 한옥마을주차장과는 멀리있기때문에 가까운 곳에 주차하시는것을 추천드려요
1130,숨,전주에 고즈넉함을 느낄수 있는 숙소여서 너무 좋았습니다! 사장님도 친절하시고 세심하게 응대해주셔서 너무 좋았습니다 ㅎㅎ. 다만 방음이 약한건 어느정더 감수해야할 부분인 것 같아요!
1131,숨,급 떠나는 여행 전날 우연하게 숙소자리가 있어서 너무 운좋게 여행다녀왔어요~! 찾기도 쉬웠고 평일이라서 사람이 많지않아 운좋게 숙소 가까이에 주차도 하고 여러모로 운이 좋았어요 ! 방에 들어가자마자 향도 엄청 좋고 깔끔하고 좋았습니다 특히 온돌바닥 엄청 뜨뜻했어요
1132,숨,"너무 아름다운 곳이에요. 다음엔 단독 방으로 예약 해보려고요, 정말 좋았어요"
1133,숨,"일찍 체크인도 도와주시고 꿀팁이나 맛집을 알려주셨던 호스트분 덕분에 일정 중간중간 숙소에 들어와 쉴 수 있었습니다. 인테리어도 깔끔하고 사진도 잘 나왔지만 어쩔 수 없이 한옥이다보니 방음이 안되어서 혹시라도 주변에 피해가 갈까봐 조심하게 되었어요ㅜㅠ 조금은 답답한 느낌이 들어서 계속 환풍기를 틀어놓았었는데, 환기 시스템이 더 개선된다면 좋을 것 같다는 생각이 들었습니다!! 다음번에는 행랑채에도 묵어보고 싶다는 생각이 들었어요. 좋은 추억 만들어주셔서 감사합니다:)"
1134,색동저고리,"2박3일동안 네송이방에서 넘 잘놀고 잘쉬다왔습니다! 늦은 입실인데도 불구하고 사장님 친절하시고, 문의사항있으면 바로 해결해주심😆😆!!! 한옥마을 메인거리 5분컷이라 너무 왔다갔다 자주함👍👍 깨끗하게 관리하셔서 그런지 인생컷 건지고 고즈넉한분위기 좋았음U0001faf0 사장님 센스로 커플한복입고 사진관까지 퍼팩트하게 추억남겼습니다❤️❤️다음에는 친구들하고 재방문할께요U0001faf6U0001faf6"
1135,색동저고리,두분 어머님께서 하룻밤 잘 쉬다오셨어요한복도 빌려입을수 있어서 더 좋았다고 합니다^^친절하게 안내도 해주시고 넘 감사합니다
1136,색동저고리,"방과 화장실 깨끗한것, 작은마당있는것, 안내 잘 해주시는 장점이 있고, 방음 잘 안되는것과 창이 작아 답답한 것이 단점입니다"
1137,색동저고리,사장님 친절하시고 방도 너무 따뜻하고 좋았어요~~다음에 전주 또 놀러 가면 여기 또 예약 할거 같아요^^
1138,색동저고리,친절한 사장님 덕분에 너무 잘 쉬다가 갑니다! 온돌 너무 따뜻하고 포근해서 좋았고 숙소도 2인이 딱 쓰기 좋은 깔끔한 숙소였어요. 투숙객은 만원에 한복대여 할 수 있는 것도 장점!! 전주에서 추천하고 싶은 숙소네요^^
1139,색동저고리,친구들과 여행가서 정말 편하게 지내고 왔습니다.방이 너무 깨끗하고 따뜻했습니다. 온수도 잘 나왔구요.게다가 사장님께서도 정말 친절하셔서 아무런 불편함이 없었습니다.다음에 또 전주 여행을 간다면 꼭 여기서 다시 머물고 싶네요.
1140,색동저고리,세번째 방문할 정도로 좋은 숙소였어요! 가성비도 좋구요!저희가 머물렀던 방은 너무 따뜻하고 편안하고 아득한 방이었어요! 친절하시고 인심좋으신 사장님 덕분에 좋은 추억 만들고 갑니다!
1141,색동저고리,쥔장님 예약 전날 주차관련하여 상세하게 문자보내주시고 방 업그레이드 해주셨어요 ㅎㅎㅎ 친절하시고 방도 깨끗해서 꿀잠 잤어요
1142,색동저고리,방이 따뜻하고 물 수압이 좋아서 또 방문해서 자고 싶습니다😆
1143,색동저고리,사장님이 친절하시고 방도 네명이 자기에 충분했어요편안히 잘지내고 왔네요~
1144,달빛향,추운날이였는데 난방도 너무 따뜻하고 화장실도 공용 아니라서 너무 편했구요 욕실 바닥 난방도 너무 센스👍🏻👍🏻 그러다보니 게하보단 개별 숙소 같아서 불편함 없이 정말 잘 이용했습니다 ! 또 사장님이 근처 구경거리랑 먹거리 정보 알려주시는것도 너무 좋았어요 다음에 전주를 다시 간다면 숙소는 무조건 달빛향 재방문 할거같아요 🤍
1145,달빛향,잘 살펴주셔서 매번 편안히 다녀갑니다.
1146,달빛향,한옥마을 초입에 위치하고 있어서 숙소찾기도 쉬웠고사장님이 추천해주시는 맛집과 관광명소 등친절한 설명에 감동받았습니다^^평일에 방문해서 편하게 조용히 푹 쉬다왔습니다~자는동안 이불속은 뜨겁고 얼굴은 시원하니 한옥의매력을 고스란히 느껴보는 하룻밤이었네요🤗
1147,달빛향,사장님이 정말 친절하시고 너무 편하게 잘 쉬고 왔습니다 ㅎㅎ!
1148,달빛향,전주 너무 좋아요 처음 가는 곳이었는데도 한국적인 것들이 잘 보존되어있는 곳이라 그런지 편안하고 낯설지 않았어요 한옥숙소는 여느 시설좋은 펜션 저리가라네요 저는 개인적으로 단칸방 한옥이 너무 따뜻하고 편안하고 좋았어요 사장님이 추천해주신 맛집도 다 성공적이었고 첫 전주여행이 여러므로 좋은 기억으로 남게되서 다음에 꼭 다시한번 가게될것같습니다 달빛향은 위치도 한옥마을에 가깝지만 초입이라 조용해서 더 만족스러웠어요
1149,달빛향,방깨끗하고 주변조용하니 쉬기도 좋고잘셨다 가요 ㅎ
1150,달빛향,편안한 숙소였어요! 저는 집 아니면 잘 못 자는데 여기서는 바닥도 따뜻하고 침구도 포근해서 숙면을 할 수 있었어요. 시골 할머니집 온 듯한 느낌이예요^^
1151,달빛향,"숙소가 딱 제가 원하던 한옥숙소였습니다. 조용히 쉴 수 있는 분위기였고 주인 아주머니께서 정말 친절하십니다. 주변 먹거리, 즐길거리 추천해주셔서 그런 거에 대해서는 걱정 없이 보낼 수 있었습니다. 화장실도 정말 깨끗하고 냉방도 시원하고 좋았습니다. 한옥마을이니 구경할 것도 많고 위치상으로도 아주 좋았습니다. 다음에 또 오고 싶은 숙소는 처음이었습니다. 덕분에 잘 쉬다 갑니다. 감사합니다."
1152,달빛향,전주 한옥마을을 즐기기에 더없이 좋은 숙소입니다. 방이 뜨뜻해서 추운 날 등 지지고 누워 있기도 좋았어요. 사장님께서 아침에 감을 주셨는데 정말 너무 맛있었습니다. 다음에 또 가고 싶은 숙소입니다.
1153,달빛향,친절하게 주변에 있는 맛집.카페 다 카톡으로 공유해주시고 특히 화장실 침구 수건이 너무 깔끔하고 물과 수건을 2박 하는동안 넉넉하게 주셨어요!! 다음 전주여행가게 되면 또 묵고싶어요ㅎㅎㅎ 한옥이라 걱정했는데 습하지않게 난방과 에어컨이 너무 잘되어있어서 뽀송하게 잘 있었어요^^ 아침에 복숭아 까지 가져다주시고 너무너무 친절하신 사장님 최고였습니당👍🏻👍🏻
1154,행복가득,"3월 3번째 주 금,토,일에 다녀왔습니다. (매화2명,국화1명)남부시장 주차장, 국립무형유산원 주차장 딱 중간이고 마을 입구에 있는 등 위치도 좋은데 조용하기까지 합니다. (지도 찍어보면 아시겠지만 위치가 절묘합니다)주말주일에 인근 주차가 굉장히 힘든데, 금요일 도착할때 주인장께서 숙소 바로 코앞에 한자리 잡아주셔서 편히 주차했습니다.주인내외분 인상좋으신데다가 친절하시고 동행분들 완전 만족하셨어요.다만, 생각하시는 방 + 1인 하시면 좀 더 편하게 지내실 수 있을거라 봅니다. (예를들어 2명이면 3인실). 국화방 1명은 짐이 없어서 1인실 문제없었는데, 매화방 2명은 짐이 좀 있으셔서 2인실이 조금 좁았네요.가격도 싸서 큰 기대 안했는데 정말 숙소문제 해결 잘 되서 다들 여행 잘하고 왔습니다"
1155,행복가득,주인분이 너무 친절하셔서 또 가고싶은 곳이에요! 위치는 한옥마을 번잡한 거리를 지나 청연루 쪽에 위치해있는데 동네는 조용하고 좋았어요! 방이 좁게 느껴질 수 있는데 여자둘이서 자기에 충분했고 온돌방이라서 너무 따뜻했어요! 저녁에는 추울 수 있지만 히터가 있어서 따뜻하게 잘 잤습니다~! 전주한옥마을 가면 또 방문하고 싶어요 ㅎㅎ
1156,행복가득,제가 작은 방을 예약 했는데 사장님이 정말 감사하게도 업그레이드를 해주셔서 ㅎㅎ 정말 편하게 있다왔습니다. 다음번에도 또 이용할게요 감사합니다~^^
1157,행복가득,고즈넉한 분위기에서 편안하게 꿀잠잤어요한옥이라 그런지 바닥은 뜨끈뜨끈☄️♨️윗공기는 안답답한 찬 공기라 더 좋았어요!사장님도 친절하시고 청연루랑 가까워서 굿아쉬운 점은 세면대 물 배수가 잘 안되어서 조금 불편했습니다🥲🥲
1158,행복가득,혼자 조용하게 묵고가기 좋았어요 사장님 너무 친절하셔서 여행기간 동안 마음 따수웠습니다!시설이야 대부분의 한옥들이 호텔만큼 편하지 않은 건 감수하고 갔던 부분이라 괜찮았어요ㅎㅎ수건도 방도 깨끗하고 무엇보다 혼자 쉬는 시간에 사장님 친절이 더해져서 마음이 편해지는 느낌이랄까요..? 무튼 덕분에 잘 쉬다 갑니다💓
1159,행복가득,방음이 잘 안되서 아쉽긴 하지만 조용히 머물다 가기 괜찮았어요!사장님이 너무 친절하시고 2시에 짐 맡기러 잠깐 들렀는데 바로 입실하게 해주셔서 좋았어요!조금 더 큰 방이 남는다고 룸 업그레이드도 해주셔서 너무 감사합니다:)
1160,행복가득,4년전에 전주한옥마을 놀러왔을때 숙박했었는데 너무 좋았어서 또 예약했는데 여전히 좋았습니다!청소나 관리도 잘되어있고 건물자체가 너무 크지 않으면서 아담하고 고즈넉한 마당이 있어 한옥을 느끼기에 오히려 좋은 것 같습니다위치도 한옥마을 중심지보다 아래쪽에있어서 프라이버시 문제나 외부소음도 거의없고 좋습니다 다만 한옥스테이기에 방음에 취약할것같아서 데시벨이 좀 큰분들은 아예 호텔같은데 묵으시거나 서로 조심하는걸 추천드립니다글구 사장님도 정말 친절하시고 뭐 좋은점밖에 없어서 저는 다음에 또 놀러가도 여기에서 묵지않을까 생각합니다ㅋㅋ 눈이와서 더 아름다웟던 한옥마을에서 잘놀구갑니다!!
1161,행복가득,가볍게 잠만 자기 좋아요방이 엄청 작고 화장실도 좁아서기대는 하면 안돼요ㅠ
1162,행복가득,여유있게 쉬기 좋은 곳입니다 ㅎㅎ 사장님이 정말 친절하십니다방도 깔끔하고 화장실도 깔끔합니다 봄에 또 들리고 싶습니다 ㅎㅎㅎㅎ
1163,행복가득,"추석연휴 기간, 아이들과 넓은 하늘을 품고, 좋은 추억 만드는 시간이었습니다.친절하신 주인장님, 번창하세요."
1164,교동살래,"우연히 방문하게 된 전주에서의 하룻밤!! 활짝 핀 꽃들이 있는 정원과 한옥의 어우러짐이 만드는 신비한 공간이었네요!! 주인장의 손길이 느껴지는 곳곳의 정성과 예쁜 소품들과 인테리어에 기억에 남으며, 어느 질문에도 정성스레 답해주시는 설명들과 따뜻한 한 잔의 커피를 건내 받으며 편안하게 잘 묵고 갑니다!! 번창하세요 -:)"
1165,교동살래,This was a great place to stay i a ice locatio. The host was very helpful ad I defiitely will be stayig agai.
1166,교동살래,23/0422~423오후 5시 도착 근처 교동주차장 마지막 차로 주차 하고. 하루 15000. 담날 10시 반까지. 그 이후 추가 요금. 가까워서 제일 좋은 주차장3명 쓰기엔 충분한 공간이에요 따뜻한물 잘나오고 화장실 깨끗 하고 공동거실이 잘 되어 있어서 좋았어요 새벽에 산책 하기에도 좋아요 ~
1167,교동살래,"저는 장미방을 예약했는데, 1층 침대가 크고, 2층도 넒게 되어 있어서 4명도 편하게 잘 수 있을거 같아요.분위기도 너무 좋고, 한옥마을과 완전 이어져있어 위치도 좋고 완전 대 만족했습니다.갑자기 비가 와서 우산이 필요했는데, 바로 대여도 해주시고 안내도 친절하게 해주셨습니다 =)한옥으로 되어 있어서 방음이 잘 안된다는 후기를 봐서 살짝 걱정했었는데, 공용공간에 나가야 옆방 소리가 들리고 방과 방끼리는 소음이 전혀 들리지 않았습니다 추천해요!"
1168,교동살래,조식 빵 되게 맛있고 침실도 푹신하니 좋았습니다 와이파이가 안 되어서 느린 속도라 사람이 다 차서 그런건줄 알았는데 고장난거였어요 따로 말씀도 안드렸는데 점검하셨는지 기사님 부르신 다음 고쳤다고 얘기도 해주시고 좋았습니다. 입실 전 짐도 맡아주셨고요.
1169,교동살래,○장점1.외관이 상당히 예쁘고2.실내도 아기자기하게 꾸며진 포인트가 다양해요3.조식 빵이 맛있어요4.소리를 제외하고는 다른 방문객들과 마주칠 일이 잘 없어서 프라이버시가 잘 지켜져요○단점1.아침에 일어났더니 바닥에 날개미들이 너무 많았어요;; 발 디딜 틈도 없이 빼곡해서 아침에 씻고 도망치듯 빠져나왔어요...2. 한옥이라 어쩔 수 없는 방음문제(말이 다 들리는건 아니고 옆 방에 사람이 들어왔구나 라고 느켜지는 정도)3. 에어컨 소리가 커요
1170,교동살래,초여름에 오니 꽃들이 만발해서 너무너무 아름다운 곳이에요 💐 한옥이라 방음은 잘안되지만 방도 깨끗하고 화장실에 온수도 잘나왔어요무료 조식을 먹을 수 있는 부엌이 있는 공용거실도 아기자기하게 꾸며놓으셨어요
1171,교동살래,"청연루 앞쪽에 위치하고 있어서 밤에도 아침에도 산책하기 좋아요, 차도랑 떨어져있고 번화가에서 조금만 걸어가면 되는 곳이라 조용하고 넘 좋았어요인테리어도 멋지고 방음도 나쁘지않았어요 ! 또 가고픈곳"
1172,교동살래,:) 창밖으로 보이는 꽃들이랑 복층의 다락방. 저희 엄마표현을 빌리자면 타샤튜더의 정원같았어요 ㅋㅋ엄마가 방이 너무 좋다구 밤 새자구 했눈데 저는 잘 자버렸습니다ㅋㅋ조식의 토스트도 맛있었어요.다음에 또 올게요!
1173,교동살래,언니랑 여행가게 되면서 결정한 숙소인데 너무 마음에 쏙 들었습니다 :)다음에 전주에 오게 된다면 재방문하고 싶네요특히 매화방은 화장실이 황제가 쓰던 욕실만큼 화려하고 멋졌어요사장님이신지는 모르겠으나 처음에 안내해주신 분도 너무 친절하셨고아무 정보도 없이 온 저희에게 완산칠봉 알려주셔서 꽃구경도 잘하고왔습니다조식으로 나온 빵도 일반 식빵이 아닌 유명 베이커리에서 파는 데니쉬식빵 같았어요너무너무 잘 놀다 갑니다 !
1174,청연,"부족한게 없는 숙소였습니다. 시부모님 상견례겸 전주 놀러왔는데, 숙소가 예쁘다며 칭찬을 많이 하셨습니다. 하나하나 칭찬하셨어요. 다음에 또 가고싶어요... 아침에 창가열어놓으니 시원한 바람과 새소리가 인상적이였습니다."
1175,청연,가격대가 있는데 그만큼의 가치가 있답니다✨청결은 말할 것도 없구요 한옥식이다 보니 벌레걱정을 했는데 단 한마리도 찾아볼 수 없었어요 ㅎㅎ 다이슨 드라이기라서 긴머리도 진짜 금방 마르구요 침구류도 너무 깨끗하고 편했고 가는 곳 마다 향기가 났어요 수건도 깔끔했고요! 저랑 남자친구 둘다 여지껏 방문했던 숙소중에 제일 좋았다고 이야기 했어요!
1176,청연,조용하고 깨끗합니다. 친절하게 해주셔서 잘 쉬다 왔습니다.
1177,청연,너무너무 행복했어요❤️예쁜 추억쌓고 왔어요!
1178,청연,너무 깔끔하고 좋아용 가족끼리 잘 쉬다 갑니다
1179,청연,너무 이쁘고 사장님이 직접 청소하셔서 그런지 정말 깨끗해요! 잘 놀다갑니다 또 올게요^^
1180,청연,너무 좋은 숙소예요.깨끗하고 조용하고 포근하고 편안하고..덕분에 전주에서 2일간 너무 행복한 시간 보내고 왔습니다.한옥마을도 걸어서 돌아다닐수 있고 주차도 가능하고 위치적으로도 최고예요.느즈막히 나가서 한옥마을 구경하고 음식들 포장해 와서 도란도란 이야기하면서 먹고 따끈한 물에 목욕하고 마무리하니 너무 행복한 하루네요. (5세 어린이 청연에서 살고싶다고 집에 안간다고 울었어요 ㅋㅋ)다음에 따뜻할때 또 가서 거실 창 다 열어두고 마루에서 커피마시고 싶어요. 또 가겠습니다~^^!청연 덕분에 집에 돌아와서도 마음이 노곤따뜻 올 한해를 기분 좋게 시작할 수 있을것 같아요 !
1181,청연,언니들에게 특급칭찬들어서너무좋았던곳 모든점에서 천백점!구지 티를 찾자면 올라가는 계단에 얼음이 얼어미끄러웠다는점? 우리간날은 눈이 너무많이왔으니 이건 자연잘못ㅋ 겨울철 눈오는날 한옥의느낌너무좋았고 한옥마을에 한옥펜션을찾는다면 제네바 스피커에서 음악도듣고 접근성도좋은 청연추천!!! 애기들놀기는별로 친구들끼리추천 연인들도 아주좋을듯!
1182,청연,"숙소 분위가 자체가 편안하고 아늑했습니다^^아이와 갔는데, 욕조도 너무 좋았구요..친절하셔서 한번 더 감동했고,사진 찍는 곳 다 예뻤어요. 여름에 한 번 더 방문 할꺼예요~^^"
1183,청연,"에어비엔비 사진 그대로에요 ! 우풍도 없고 따듯하고 깨끗하고 예쁩니다 !화장실 내 욕실도 아주아주 커서 성인여자 세명이 들어가도 충분해요 ! 다만, 물 호스가 욕조 밖으로 안나가서 욕조 안에서만 샤워가 가능함니다 😃가족여행이라서 부모님과 함께 갔는데 부모님도 너무 좋아하셨어요 ~"
1184,등용재,사장님이 너무 친절하셨어요 늦게 체크인 예정이라 미리 전화드렸는데 전혀 걱정말고 조심히 오시라고 해주셨어요 U0001f979 엄마랑 아이둘 여행이라 안전에 대한 걱정도 많았는데 걱정이 무색하게 너무 잘 지내다 왔네요 🤗 9시쯤 도착해 한옥마을 산책갔는데 너무 좋았구요 오전에 체크인하고나서도 경기전 전동성당등 걸어서 갈수있어 좋아요 사장님이 아이들 너무 예뻐해주셔서 감사했어요 아이들도 한옥 체험 해보고 좋아하고 다음에 또 전주에 간다면 다시 가고싶은 곳이에요😊방 너무 따뜻했고 물도 너무 잘나와요👍🏻👍🏻 화장실도 깨끗했어요
1185,등용재,일주일전에 급하게 예약했는데 결론은 대만족이에요~~ 사장님 넘넘 친절하세요 위치 물어봤는데 직접데리러 와주시고 응대도 늘 친절하게 해주셔서 정말 감사했어요한옥마을 숙소가격이 다 비슷비슷하다면 전 좋더라구요 방음은 아주 잘되진 않았지만 ㅎㅎ 그것도 다 비슷비슷해요 ㅎㅎ넘 좋은 기억이었어요~^^
1186,등용재,"신랑이랑 급하게 알아보고 다녀온 전주여행인데, 숙박은 사실 큰 기대를 하지않았어요. 그런데 정말 너~무좋았습니다. 방 크기가 아담하지만 둘이 1박하기에 딱 좋았고 너무 깔끔했고, 화장실도 깨끗하고 따뜻한물도 잘나오고 난방은 진짜 바닥이 절절끓을정도로 따뜻했습니다. 너무 잘묵고왔습니다. 다음에 또 전주여행가게되면 무조건 등용재에서 묵을거에요 ㅎ 무엇보다 사장님께서 너무 친절하셔서 더 좋았습니다. 덕분에 즐거운 시간 보내고왔습니다^^"
1187,등용재,친절하시고 작지만 아담해요방도 따뜻하다 못해 뜨겁고^^ 침구도 깔끔해요바닥 체질이 아니다보니 이틀자고 온몸이 아프지만^^ 딸들과 잘 쉬다왔습니다
1188,등용재,깔끔하고 좋았어요. 온돌이 엄청 따뜻했어요!
1189,등용재,잘쉬다 왔습니다. 사진도 찍어주시고 너무 친절하십니다~^^
1190,등용재,아기자기하고 고즈넉한 분위기가 정말 좋았습니다~ 아기가 있다고 사장님께서 무척 신경써주셨어요 감사해요^^ 한옥마을 바로 안에 있어서 먹거리 구경거리도 참 많았던것 같습니다~ 좋은 추억 남기고 갑니다~ 감사해요!
1191,등용재,"대문을 열고 들어가는 순간, 마당정원이 너무 예뻐 감탄했어요.편하게 힐링하고 귀한 화초도 분양받았습니다.꽃처럼 마음이 예쁘신 사장님 ~~항상 건강하세요."
1192,등용재,따뜻한 온돌에서 잘 자고 왔습니다
1193,등용재,친절하고 깨끗하고 볼거리가 많아 좋아요
